title,author,journal,year,source,pages,volume,abstract,document_type,doi,url,affiliation,author_keywords,keywords,publisher,issn,language,note,status,selection_criteria
An architectural style for scalable choreography-based microservice-oriented distributed systems,"Filippone, Gianluca and Pompilio, Claudio and Autili, Marco and Tivoli, Massimo",Computing,2023,Scopus,1933 - 1956,105,"Service choreographies are a versatile approach for building service-based distributed systems. Many approaches can be found in the literature tackling different aspects of service choreographies, such as choreography realizability and conformance checking, distributed coordination, formal choreographic languages, and scalability. As of today, choreography scalability has not been specifically addressed through approaches that also consider coordination issues while still decoupling these two related aspects. Scalability is one of the most important properties to be considered when building distributed systems. It enhances the user-perceived performances and influences the overall dependability of the system. In particular, load scalability allows distributed service-oriented systems to effectively handle varying loads without suffering performance degradation. In this direction, microservice-based systems are able to scale thanks to the possibility of replicating those microservices exposed to growing loads, distributing their workload among different instances. By leveraging on our experience in coordinating service choreographies, in this paper, we propose a layered architectural style that allows to realize scalable microservice-oriented choreographies. The architecture integrates a fully-distributed coordination layer capable of ensuring the correct interactions and a load-balancing layer that allows to balance of coordinated requests. We discuss the properties of the proposed architectural style and evaluate its benefits on user-perceived performances. © 2022, The Author(s), under exclusive licence to Springer-Verlag GmbH Austria, part of Springer Nature.",Article,10.1007/s00607-022-01139-5,https://www.scopus.com/inward/record.uri?eid=2-s2.0-85143627065&doi=10.1007%2Fs00607-022-01139-5&partnerID=40&md5=99268a3d9dd57170a99d75632836bdea,,Distributed systems; Load balancing; Microservices; Scalability,Architecture; Architectural style; Building services; Distributed coordination; Distributed systems; Load-Balancing; Microservice; Perceived performance; Property; Service choreographies; Service-based distributed systems; Scalability,,,,Cited by: 2,Rejected,"Studies that discuss software architecture in general without addressing conformance, compliance, or consistency."
Reliable Monitoring for Runtime Validation of Choreographies,"von Riegen, Michael and Ritter, Norbert",,2009,IEEE Digital Library,310-315,,"Cross-organizational business processes gain more and more attention in the scientific community. For modeling these processes, choreographies are an adequate solution to describe the observable behavior for each business participant and the corresponding protocols between them. Nevertheless, current approaches mainly focus on modeling and conformance checking before runtime. In contrast, this contribution concentrates on the runtime validation of choreographies and will thus propose a monitoring infrastructure that supports this validation. We will sketch the requirements for a monitoring infrastructure as well as the solutions in order to meet these requirements. Without such a reliable monitoring framework, a runtime validation framework simply would not be able to correctly validate the interactions.",,10.1109/ICIW.2009.52,,,,Monitoring;Runtime;Web services;Service oriented architecture;Instruments;Transport protocols;Collaboration;Web and internet services;Information systems;Business communication;service-oriented architectures;cross-organizational business processes;choreographies;monitoring;validation;interactions,,,,,Rejected,Studies that do not address Architectural Conformance Checking as a central topic.
A Symmetric Petri Net Model of Generic Publish-Subscribe Systems for Verification and Business Process Conformance Checking,"Meyer, Tom",CEUR Workshop Proceedings,2023,Scopus,88 - 109,3430,"The highly decoupled nature of distributed systems can greatly simplify modular development. However, it is easy to lose track of component interactions and emerging system behavior. To inspect the behavior of the aggregated system, an abstract model and analysis tools can be of great help. In this paper, we present such a model that follows the Event-Driven Architecture paradigm. We argue that a Petri net model that captures the event flow, without modeling event data, is a useful abstraction to give insight into a system composed of distributed components. We present a symmetric Petri net model with publish-subscribe middleware and a generic abstraction of components. The model was designed with the intention to produce a finite P/T net to be compatible with current Petri net model checking tools. To build such a model, information about component behavior is necessary. We show that this information is encoded in the system implementation, and we describe potential means for automatic extraction. With the formal Petri net model, we enable the use of established verification methods. We discuss ideas from business process conformance checking and other verification properties that may deepen the system understanding. The proposed methods can be used either for static analysis during design time or to automatically signal issues at runtime. © 2023 Copyright for this paper by its authors. Use permitted under Creative Commons License Attribution 4.0 International (CC BY 4.0).",Conference paper,,https://www.scopus.com/inward/record.uri?eid=2-s2.0-85166003230&partnerID=40&md5=ad17cf37b861564cb633ca803ac7775f,,Conformance Checking; Distributed System; Event-Driven Architecture; Petri Net Model; Publish-Subscribe; Verification,Message passing; Middleware; Model checking; Petri nets; Static analysis; Business Process; Conformance checking; Distributed systems; Event-driven architectures; Modular development; Petri net models; Publish/subscribe; Publish/Subscribe system; Symmetrics; Verification process; Abstracting,,,,Cited by: 5,Rejected,Studies that do not address Architectural Conformance Checking as a central topic.
Web service choreography conformance verification through the piX-model,"van Seghbroeck, Gregory and Volckaert, Bruno and de Turck, Filip D. and Dhoedt, Bart and Demeester, Piet M.A.",International Journal of Cooperative Information Systems,2010,Scopus,1 - 30,19,"As the adoption of the Service Oriented Architecture paradigm has dramatically increased over the past few years, proper coordination of loosely coupled services becomes an important issue when building state-of-the-art applications. This coordination is typically organized through orchestration (requiring a central coordinating entity) or through choreographies. While the latter approach allows for a fully distributed coordination, the need also arises for a distributed conformance check, ensuring that each participant of the choreography behaves according to the general choreography. In this paper, a formalism is presented to ensure this conformance at design time, with possible extensions to deploy time and to runtime conformance checking. This formalism is referred to as the piX-model and it will be shown that the approach taken is inherently less complex, both in time and space, than the conventional π-calculus-based approach, whilst offering the same conformance guarantees. This gain in performance allows for a small design turnaround time, and also opens the avenue to runtime conformance checking by resource constrained devices. © 2010 World Scientific Publishing Company.",Article,10.1142/S0218843010002097,https://www.scopus.com/inward/record.uri?eid=2-s2.0-77953822042&doi=10.1142%2FS0218843010002097&partnerID=40&md5=59cb8e3b64c6aa0f7de30b851b9e31e4,,choreography; open bisimulation; Web services; WS-CDL,,,,,Cited by: 2,Rejected,Studies that do not address Architectural Conformance Checking as a central topic.
A formal and visual modeling approach to choreography based web services composition and conformance verification,"Yeung, Wing Lok",Expert Systems with Applications,2011,Scopus,12772 - 12785,38,"Web services have emerged as the building blocks of a service-oriented architecture that supports not only enterprise application integration (EAI) and business process management (BPM) within an organization but also B2B collaboration based on business process integration. The web services choreography approach to B2B process integration allows business partners to orchestrate their own web services privately, while conforming with an agreed specification of the common ordering conditions and constraints under which messages are exchanged among partners' web services. In this approach, choreography conformance is an essential requirement for the successful implementation of collaborative processes. A formal approach to web services composition and conformance verification based on WS-CDL and WS-BPEL is presented. This approach involves model checking as an automated means of verifying choreography conformance. The main contributions include a precise notion of choreography conformance on which verification is based as well as support for the complementary use of visual modeling (e.g. UML) and standard WS-* notations in composition. © 2010 Elsevier Ltd. All rights reserved.",Article,10.1016/j.eswa.2011.04.068,https://www.scopus.com/inward/record.uri?eid=2-s2.0-79957995532&doi=10.1016%2Fj.eswa.2011.04.068&partnerID=40&md5=afe862255cad1bfca3badf60847427cb,,Choreography; Conformance verification; Contract negotiation; Model checking; Orchestration; Web services,B2B collaboration; Building blockes; Business partners; Business process integration; Business process management; Choreography; Collaborative process; Conformance verification; Contract negotiation; Enterprise application integration; Formal approach; Orchestration; Process integration; Service Oriented; Visual modeling; Web services composition; WS-BPEL; Enterprise resource management; Information services; Integration; Model checking; Service oriented architecture (SOA); User interfaces; Web ,,,,Cited by: 24,Rejected,Studies that do not address Architectural Conformance Checking as a central topic.
Automatic reference architecture conformance checking for SOA - Based software systems,"Weinreich, Rainer and Buchgeher, Georg",,2014,Scopus,95 - 104,,"Company-wide reference architectures are an important means for standardization and reuse. Standardization is enforced through reference architecture conformance checking. Manual conformance checking is too time- and resource-intensive to be performed continuously for the various systems that are part of a SOA. We present an approach for automatic reference architecture conformance checking of SOA-based software systems. Reference architectures are defined based on rules consisting of roles and of constraints on roles and role relationships. By mapping the roles to the elements of a software architecture representation, reference architecture specifications are reusable for different software systems. Through automating the whole checking process, including architecture extraction, role mapping, and rule evaluation, the approach can be applied continuously for the different systems that are part of a SOA. The approach has been developed and refined by applying it to a SOA in the banking domain. During its evolution from semi-automatic to a fully automatic approach it has also changed the way of how architecture information is provided as part of the system implementation in this domain. © 2014 IEEE.",Conference paper,10.1109/WICSA.2014.22,https://www.scopus.com/inward/record.uri?eid=2-s2.0-84903699771&doi=10.1109%2FWICSA.2014.22&partnerID=40&md5=96fd4bda5bf10a64931ef66740c65973,,conformance checking; reference architecture; service-oriented architecture (SOA); software architecture,Computer software; Information services; Mapping; Service oriented architecture (SOA); Software architecture; Standardization; Automatic approaches; Conformance checking; Reference architecture; Rule evaluation; Semi-automatics; Software systems; System implementation; Architecture,,,,Cited by: 19,Accepted,"Studies addressing ACC in microservice-based systems, including cloud-native and event-driven distributed architectures explicitly aligned with the microservices paradigm."
Ensuring and assessing architecture conformance to microservice decomposition patterns,"Zdun, Uwe and Navarro, Elena M. and Leymann, Frank",Lecture Notes in Computer Science,2017,Scopus,411 - 429,10601 LNCS,"Microservice-based software architecture design has been widely discussed, and best practices have been published as architecture design patterns. However, conformance to those patterns is hard to ensure and assess automatically, leading to problems such as architectural drift and erosion, especially in the context of continued software evolution or large-scale microservice systems. In addition, not much in the component and connector architecture models is specific (only) to the microservices approach, whereas other aspects really specific to that approach, such as independent deployment of microservices, are usually modeled in other views or not at all. We suggest a set of constraints to check and metrics to assess architecture conformance to microservice patterns. In comparison to expert judgment derived from the patterns, a subset of these constraints and metrics shows a good relative performance and potential for automation. © Springer International Publishing AG 2017.",Conference paper,10.1007/978-3-319-69035-3_29,https://www.scopus.com/inward/record.uri?eid=2-s2.0-85034118349&doi=10.1007%2F978-3-319-69035-3_29&partnerID=40&md5=09028be9a2824f32498a3cc9a1e061cb,,,Artificial intelligence; Computer science; Computers; Architecture designs; Best practices; Connector architectures; Expert judgment; Relative performance; Software architecture design; Software Evolution; Distributed computer systems,,,,Cited by: 40; All Open Access; Green Accepted Open Access; Green Open Access,Accepted,"Studies addressing ACC in microservice-based systems, including cloud-native and event-driven distributed architectures explicitly aligned with the microservices paradigm."
Assessing architecture conformance to coupling-related patterns and practices in microservices,"Ntentos, Evangelos and Zdun, Uwe and Plakidas, Konstantinos and Meixner, Sebastian and Geiger, Sebastian",Lecture Notes in Computer Science,2020,Scopus,3 - 20,12292 LNCS,"Microservices are the go-to architectural style for building applications that are polyglot, support high scalability, independent development and deployment, and are rapidly adaptable to changes. Among the core tenets for a successful microservice architecture is high independence of the individual microservices, i.e. loose coupling. A number of patterns and best practices are well-established in the literature, but most actual microservice-based systems do not, as a whole or in part, conform to them. Assessing this conformance manually is not realistically possible for large-scale systems. This study aims to provide the foundations for an automated approach for assessing conformance to coupling-related patterns and practices specific for microservice architectures. We propose a model-based assessment based on generic, technology-independent metrics, connected to typical design decisions encountered in microservice architectures. We demonstrate and assess the validity and appropriateness of these metrics by performing an assessment of the conformance of real-world systems to patterns through statistical methods. © Springer Nature Switzerland AG 2020.",Conference paper,10.1007/978-3-030-58923-3_1,https://www.scopus.com/inward/record.uri?eid=2-s2.0-85091491521&doi=10.1007%2F978-3-030-58923-3_1&partnerID=40&md5=40ac2ec320983cc02b5585a7b76de071,,,Software architecture; Architectural style; Automated approach; Building applications; High scalabilities; Loose couplings; Model-based OPC; Real-world system; Technology independent; Large scale systems,,,,Cited by: 14,Accepted,"Studies addressing ACC in microservice-based systems, including cloud-native and event-driven distributed architectures explicitly aligned with the microservices paradigm."
Metrics for assessing architecture conformance to microservice architecture patterns and practices,"Ntentos, Evangelos and Zdun, Uwe and Plakidas, Konstantinos and Meixner, Sebastian and Geiger, Sebastian",Lecture Notes in Computer Science,2020,Scopus,580 - 596,12571 LNCS,"Many contemporary service-based systems follow the microservice approach, particularly in DevOps or continuous delivery contexts. They share a set of important tenets such as independent development and deployment, high releasability, polyglot technology support, and loose coupling. A number of best practices for microservice architectures have been codified as patterns, which embody those tenets. However, no real-world microservices system can support all patterns and practices well, but rather architectural decisions making trade-offs among them are needed. Conformance to the patterns and practices selected in such decisions is hard to ensure and assess automatically, especially in large-scale, complex, and evolving systems. In this work, we propose a model-based approach based on generic, technology-independent metrics, tied to typical architectural design decisions in the microservice domain. With this approach we can measure conformance to the patterns and related tenets. We demonstrate and assess the validity and appropriateness of these metrics in performing an assessment of a system’s conformance to patterns through statistical methods. © Springer Nature Switzerland AG 2020.",Conference paper,10.1007/978-3-030-65310-1_42,https://www.scopus.com/inward/record.uri?eid=2-s2.0-85098257999&doi=10.1007%2F978-3-030-65310-1_42&partnerID=40&md5=3aa4617740e9ab7d0afe4515c2f39740,,,Economic and social effects; Architectural decision; Architectural design decisions; Architecture patterns; Evolving systems; Model based approach; Service-based systems; Technology independent; Technology support; Architecture,,,,Cited by: 9,Accepted,"Studies addressing ACC in microservice-based systems, including cloud-native and event-driven distributed architectures explicitly aligned with the microservices paradigm."
Applying a multi-platform architectural conformance solution in a real-world microservice-based system,"Araujo, Elena A. and Espíndola, Álvaro M. and Garcia, Vinícius Cardoso and Terra, Ricardo",ACM International Conference Proceeding Series,2020,Scopus,41 - 50,,"Microservice architectures are composed of a set of independent microservices that execute well-defined functionalities, allowing each one to be developed in different programming languages and data management technologies. The problem, however, is that such heterogeneity implies in a harder verification process of communication among microservices and the architectural designs of each microservice. Although the state-of-the-art provides several architectural conformance solutions, none formally restricts communications (e.g., over HTTP) between different systems. Even stable and industrial solutions - -such as Kubernetes, Terraform, and Docker Compose - -provide basic mechanisms to restrict communications between microservices. Thereupon, this paper proposes and evaluates a multi-platform architectural conformance solution for the microservice architecture. For this purpose, (i) we specify an architectural constraint language, called DCL+ - -adapted from the DCL (Dependency Constraint Language) language; (ii) we propose a multi-platform process that restricts the communication between the microservices and also verifies the architectural projects of each one of them; (iii) we develop DCL+check, a tool that implements the proposed solution; (iv) we apply our process in a medium-size real-world application composed of eleven microservices, developed in two different languages (JavaScript and Java). As result, we found 16 communication and 171 structural design violations. The communication violations occurred in general due to the lack of knowledge of the developers about the restrictions of communication among the modules of the orchestrator system and other microservices, as well as the evolution of two microservices. © 2020 ACM.",Conference paper,10.1145/3425269.3425270,https://www.scopus.com/inward/record.uri?eid=2-s2.0-85095810870&doi=10.1145%2F3425269.3425270&partnerID=40&md5=e7e0a97f76bf857656bc9c0a149ea44a,,,Computer software reusability; Structural design; Architectural constraints; Architectural projects; Basic mechanism; Dependency constraints; Industrial solutions; Management technologies; State of the art; Verification process; Information management,,,,Cited by: 0,Accepted,"Studies addressing ACC in microservice-based systems, including cloud-native and event-driven distributed architectures explicitly aligned with the microservices paradigm."
Towards a method for monitoring the coupling evolution of microservice-based architectures,"de Freitas Apolinário, Daniel Rodrigo and de França, Breno Bernard Nicolau",ACM International Conference Proceeding Series,2020,Scopus,71 - 80,,"The microservice architecture is claimed to satisfy ongoing software development demands, such as resilience, flexibility, and velocity. However, developing applications based on microservices also brings some drawbacks, such as the increased software operational complexity. Recent studies have also pointed out the lack of methods to prevent problems related to the maintainability of these solutions. Disregarding established design principles during the software evolution may lead to the so-called architectural erosion, which can end up in a condition of unfeasible maintenance. As microservices can be considered a new architecture style, there are few initiatives to monitoring the evolution of software microservice-based architectures. In this paper, we introduce the SYMBIOTE method for monitoring the coupling evolution of microservice-based systems. More specifically, this method collects coupling metrics during runtime (staging or production environments) and monitors them throughout software evolution. The longitudinal analysis of the collected measures allows detecting an upward trend in coupling metrics that could be signs of architectural erosion. To develop the proposed method, we performed an experimental analysis of the coupling metrics behavior using artificially-generated data. © 2020 ACM.",Conference paper,10.1145/3425269.3425273,https://www.scopus.com/inward/record.uri?eid=2-s2.0-85095820890&doi=10.1145%2F3425269.3425273&partnerID=40&md5=add7766e1e8a85bb98d13c462bb4a90c,,Coupling metrics; Maintainability; Microservices; Software Evolution,Application programs; Computer software reusability; Erosion; Architecture styles; Coupling evolution; Design Principles; Experimental analysis; Longitudinal analysis; Operational complexity; Production environments; Software Evolution; Software design,,,,Cited by: 3,Accepted,"Studies addressing ACC in microservice-based systems, including cloud-native and event-driven distributed architectures explicitly aligned with the microservices paradigm."
Evaluating and Improving Microservice Architecture Conformance to Architectural Design Decisions,"Ntentos, Evangelos and Zdun, Uwe and Plakidas, Konstantinos and Geiger, Sebastian",Lecture Notes in Computer Science,2021,Scopus,188 - 203,13121 LNCS,"Microservices are a commonly used architectural style targeting independent development, deployment, and release of services, as well as supporting polyglot capabilities and rapid release strategies. This depends on the presence of certain software architecture qualities. A number of architecture patterns and best practices that support the required qualities have been proposed in the literature, but usually in isolation of one another. Additionally, in real-world systems, assessing conformance to these patterns and practices and detecting possible violations is a significant challenge. For small-scale systems of a few services, a manual assessment and violation detection by an expert is probably both accurate and sufficient. However, for industrial-scale systems of several hundred or more services, manual assessment and violation detection is laborious and likely leads to inaccurate results. Furthermore, manual assessment is impractical for rapidly evolving and frequently released system architectures. In this work we examine a subset of microservice-relevant patterns, and propose a method for the semi-automatic detection and resolution of conformance violations. Our aim is to assist the software architect by providing a set of possible fix options and generating models of “fixed” architectures. © 2021, Springer Nature Switzerland AG.",Conference paper,10.1007/978-3-030-91431-8_12,https://www.scopus.com/inward/record.uri?eid=2-s2.0-85120524117&doi=10.1007%2F978-3-030-91431-8_12&partnerID=40&md5=7c0a3ca83ce0ea7e29e48e83a98d3392,,,Architectural design decisions; Architectural style; Architecture patterns; Best practices; Industrial scale systems; Rapid release; Real-world system; Release strategies; Small-scale systems; Violation detections; Software architecture,,,,Cited by: 5,Accepted,"Studies addressing ACC in microservice-based systems, including cloud-native and event-driven distributed architectures explicitly aligned with the microservices paradigm."
