title,author,journal,year,source,pages,volume,abstract,document_type,doi,url,affiliation,author_keywords,keywords,publisher,issn,language,note,status,selection_criteria
DOMICO: Checking conformance between domain models and implementations,"Zhong, Chenxing and Zhang, He and Huang, Huang and Chen, Zhikun and Li, Chao and Liu, Xiaodong and Li, Shanshan",Software - Practice and Experience,2024,Scopus,595 - 616,54,"As a predominant design method for microsservices architecture (MSA), domain-driven design (DDD) utilizes a series of standard patterns in both models and implementations to effectively support the design of architectural elements. However, an implementation may deviate from its original domain model that uses certain patterns. The deviation between a domain model and its implementation is a type of architectural drift, which needs to be detected promptly. This paper proposes an approach, namely DOMICO, to check the conformance between the domain model and its implementation, by which the conformance is formalized by defining eight common structural patterns of domain modeling and their representations in both models and the corresponding source code. Based on the formalization, our approach can not only identify the discrepancies (e.g., divergence, absence, and modification) with respect to pattern elements, but also detect possible violations of 24 compliance rules imposed by the patterns. To validate DOMICO, we performed a case study to investigate its use in a supply chain project and its performance. The results show that DOMICO can accurately identify 100% inconsistency issues in the cases examined. As the first conformance checking approach for DDD, DOMICO can be integrated into the regular domain modeling process and help ensure the conformity of microservice implementations to models. © 2023 John Wiley & Sons, Ltd.",Article,10.1002/spe.3272,https://www.scopus.com/inward/record.uri?eid=2-s2.0-85174190323&doi=10.1002%2Fspe.3272&partnerID=40&md5=77117fcaf4d7e21b10d8ffbc4c176c19,,architectural drift; architecture conformance checking; code implementation; domain model; domain-driven design; microservices architecture,Architectural design; Codes (symbols); Architectural drift; Architectural element; Architecture conformance checking; Code implementation; Conformance checking; Design method; Domain model; Domain-driven designs; Microservice architecture; Standard pattern; Supply chains,,,,Cited by: 5; All Open Access; Bronze Open Access,Accepted,Studies that explicitly investigate Architectural Conformance Checking (ACC) in software systems.
Detection Strategies for Microservice Security Tactics,"Zdun, Uwe and Queval, Pierre Jean and Simhandl, Georg and Scandariato, Riccardo and Chakravarty, Somik and Jelić, Marjan and Jovanović, A. S.",IEEE Transactions on Dependable and Secure Computing,2024,Scopus,1257 - 1273,21,"Microservice architectures are widely used today to implement distributed systems. Securing microservice architectures is challenging because of their polyglot nature, continuous evolution, and various security concerns relevant to such architectures. This article proposes a novel, model-based approach providing detection strategies to address the automated detection of security tactics (or patterns and best practices) in a given microservice architecture decomposition model. Our novel detection strategies are metrics-based rules that decide conformance to a security recommendation based on a statistical predictor. The proposed approach models this recommendation using Architectural Design Decisions (ADDs). We apply our approach for four different security-related ADDs on access management, traffic control, and avoiding plaintext sensitive data in the context of microservice systems. We then apply our approach to a model data set of 10 open-source microservice systems and 20 variants of those systems. Our results are detection strategies showing a very low bias, a very high correlation, and a low prediction error in our model data set. © 2004-2012 IEEE.",Article,10.1109/TDSC.2023.3276487,https://www.scopus.com/inward/record.uri?eid=2-s2.0-85160216527&doi=10.1109%2FTDSC.2023.3276487&partnerID=40&md5=9c14d9de24c27f20d68ba619a574a65d,,Conformance checking; detection strategies; metrics; microservice architecture security; microservices,Authorization; Information management; Network security; Open systems; Sensitive data; Architectural design decisions; Code; Conformance checking; Detection strategy; Metric; Microservice; Microservice architecture; Microservice architecture security; Modeling data; Security; Computer architecture,,,,Cited by: 3; All Open Access; Hybrid Gold Open Access,Accepted,"Studies addressing ACC in microservice-based systems, including cloud-native and event-driven distributed architectures explicitly aligned with the microservices paradigm."
CATMA: Conformance Analysis Tool for Microservice Applications,"Cao, Clinton and Schneider, Simon and Díaz Ferreyra, Nicolás E. and Verwer, Sicco E. and Panichella, Annibale and Scandariato, Riccardo",Proceedings - International Conference on Software Engineering,2024,Scopus,59 - 63,,"The microservice architecture allows developers to divide the core functionality of their software system into multiple smaller services. However, this architectural style also makes it harder for them to debug and assess whether the system's deployment conforms to its implementation. We present CATMA, an automated tool that detects non-conformances between the system's deployment and implementation. It automatically visualizes and generates potential interpretations for the detected discrepancies. Our evaluation of CATMA shows promising results in terms of performance and providing useful insights. CATMA is available at https://cyberanalytics. nl/catma.github.io/, and a demonstration video is available at https://youtu.be/WKP1hG-TDKc. © 2024 IEEE Computer Society. All rights reserved.",Conference paper,10.1145/3639478.3640022,https://www.scopus.com/inward/record.uri?eid=2-s2.0-85188258629&doi=10.1145%2F3639478.3640022&partnerID=40&md5=1f4f18ceba149d26d74bb010a0657fb2,,dynamic analysis; empirical software engineering; microservices; software testing; static analysis,Application programs; HTTP; Program debugging; Static analysis; Analysis tools; Architectural style; Automated tools; Core functionality; Dynamics analysis; Empirical Software Engineering; Microservice; Software testings; Software-systems; System deployment; Software testing,,,,Cited by: 4; All Open Access; Gold Open Access; Green Open Access,Accepted,"Studies addressing ACC in microservice-based systems, including cloud-native and event-driven distributed architectures explicitly aligned with the microservices paradigm."
"Increased reliability in SOA environments through registry-based
conformance testing of Web services","Kourtesis, D. and Ramollari, E. and Dranidis, D. and Paraskakis, I.",PRODUCTION PLANNING \& CONTROL,2010,ISI Web of Science,130-144,21,"Organisations wishing to engage in industrial collaborative networks
will typically seek some guarantees concerning the reliability of their
prospective partners before committing to cooperation. Evaluating
reliability can encompass several aspects, but one of the most crucial
things to consider from a cooperation perspective is whether the
software systems that support the business processes of some
collaborator actually behave as expected. For organisations that rely on
a service-oriented computing infrastructure, this amounts to checking
whether the functionality of the respective services is conformant to a
given behavioural specification. Today's state of the art lacks
standardised methods for creating behavioural specifications of Web
services, and also lacks tools for automating the process of behavioural
conformance checking through testing. This paper presents a concrete
method for creating formal specifications of Web service behaviour and
utilising them within service registries for automated testing of
service implementations in order to verify and certify their
conformance.",Article,10.1080/09537280903441922,,"Kourtesis, D (Corresponding Author), Univ Sheffield, Res Ctr, SEERC, 24 Proxenou Koromila Str, Thessaloniki 54622, Greece.
Kourtesis, D.; Ramollari, E.; Dranidis, D.; Paraskakis, I., Univ Sheffield, Res Ctr, SEERC, Thessaloniki 54622, Greece.
Kourtesis, D.; Ramollari, E.; Dranidis, D.; Paraskakis, I., CITY Coll, Thessaloniki 54622, Greece.
Dranidis, D., Univ Sheffield, Int Fac, Dept Comp Sci, CITY Coll, Thessaloniki 54626, Greece.",,Web services; registry; behavioural conformance; testing,TAYLOR \& FRANCIS LTD,0953-7287,English,,Rejected,Studies that do not address Architectural Conformance Checking as a central topic.
A runtime monitoring and validation framework for Web service interactions,"Li, Z. and Jin, Y. and Han, J.",,2006,IEEE Digital Library,10 pp.-79,,"Web services are designed for composition and use by third parties through dynamic discovery. As such, the issue of interoperability between services is of great importance to ensure that the services can work together towards the overall application goals. In particular, the interaction protocols of a service need to be implemented and used properly so that the service composition can conduct itself in an orderly fashion. In our previous work, we have proposed a lightweight, pattern/constraint-based approach to specifying service interaction protocols. It has been incorporated into OWL-S for service developers to describe service interaction constraints. In this paper, we present a framework for monitoring the run-time interaction behaviour of Web services and validating the behaviour against their pre-defined interaction constraints. The framework involves interception of service interactions/messages, representation of interaction constraints using finite state automata, and conformance checking of service interactions against interaction constraints. As such, the framework provides a useful tool for validating the implementation and use of services regarding their interaction behaviour",,10.1109/ASWEC.2006.6,,,,Runtime;Monitoring;Web services;Protocols;Australia;Automata;Contracts;Service oriented architecture;Bridges;Software engineering,,2377-5408,,,Rejected,Studies that do not address Architectural Conformance Checking as a central topic.
Mining and checking web services behavior,"Wan, Xiaomin and Mao, Xiaoguang and Dai, Ziying",,2012,IEEE Digital Library,1004-1009,,"As an emerging paradigm for architecting, service-oriented computing plays a more and more important role in information technology. To ensure that web services are working according with the expectation, the research in service behavior about interactions between services is crucial to guarantee no deviation from specification. To detect these deviations, we propose a method to mine and check web service behavior. The method attempts to apply process mining to interactions between services in order to narrow the gap between service consumers and providers. By observing executions of services, we present three levels of abstraction on service behavior: internal behavior, external behavior and workflow behavior. Then we outline the approach to extract behavioral model that provides specification to the activity of service checking. Finally the framework of service behavior checking is presented.",,10.1109/INDIN.2012.6301239,,,,Data mining;Customer services;Simple object access protocol;Automata;Computational modeling;web service mining;conformance checking;web services;behavioral model,,2378-363X,,,Rejected,Studies that do not address Architectural Conformance Checking as a central topic.
Continuous Conformance of Software Architectures,"Bucaioni, Alessio and Di Salle, Amleto and Iovino, Ludovico and Mariani, Leonardo and Pelliccione, Patrizio",,2024,IEEE Digital Library,112-122,,"Software architectures are pivotal in the success of software-intensive systems and serve as foundational elements that significantly impact the overall software quality. Reference architectures abstract software elements, define main responsibilities and interactions within a domain, and guide the architectural design of new systems. Using reference architectures offers advantages like enhanced interoperability, cost reduction through reusability, decreased project risks, improved communication, and adherence to best practices. However, these benefits are most pronounced when software architectures align with reference architectures. Deviations from prescribed reference architectures can nullify these benefits. Uncontrolled misalignment can become prohibitively expensive, necessitating costly redevelopments, with maintenance costs reaching up to 90% of development costs. Conformance-checking processes and identifying and resolving violations in the software architecture are essential to mitigate misalignment. To address these challenges, we introduce the concept of continuous conformance that is expressed as a distance function, together with a process supporting it. Continuous conformance quantifies the degree to which a software architecture adheres to a designated reference architecture. The conformance concept enables multi-level, incremental, and non-blocking checking and restoration tasks and allows the check of partial architectures without obstructing the design process. We operationalize this process through an assistive modeling tool to architect an Internet of things-based system.",,10.1109/ICSA59870.2024.00019,,,,Costs;Software architecture;Computer architecture;Software quality;Maintenance;Internet;Task analysis;Reference architecture;conformance;modeling assistant,,2835-7043,,,Accepted,"Studies that propose, analyze, or evaluate methods, techniques, approaches, tools, or frameworks for ACC."
Runtime Monitoring of Web Service Conversations,"Simmonds, Jocelyn and Gan, Yuan and Chechik, Marsha and Nejati, Shiva and O'Farrell, Bill and Litani, Elena and Waterhouse, Julie",IEEE Transactions on Services Computing,2009,IEEE Digital Library,223-244,2,"For a system of distributed processes, correctness can be ensured by (statically) checking whether their composition satisfies properties of interest. However, Web services are distributed processes that dynamically discover properties of other Web services. Since the overall system may not be available statically and since each business process is supposed to be relatively simple, we propose to use runtime monitoring of conversations between partners as a means of checking behavioral correctness of the entire Web service system. Specifically, we identify a subset of UML 2.0 Sequence Diagrams as a property specification language and show that it is sufficiently expressive for capturing safety and liveness properties. By transforming these diagrams to automata, we enable conformance checking of finite execution traces against the specification. We show how our language can be used to specify the Specification Property System (SPS) [1]. We describe an implementation of our approach as part of an industrial system. Finally, we discuss our experience of specifying and monitoring a number of properties from three existing applications.",,10.1109/TSC.2009.16,,,,Monitoring;Web services;Automata;Runtime;Unified modeling language;Data mining;Probability density function;Nondeterministic finite automata;runtime monitoring;sequence diagrams;temporal logic patterns;Web service conversations.,,1939-1374,,,Rejected,Studies that do not address Architectural Conformance Checking as a central topic.
Verifying conformance between Web service choreography and implementation using learning and model checking,"Pacharoen, Warawoot and Aoki, Toshiaki and Bhattarakosol, Pattarasinee and Surarerks, Athasit",,2011,IEEE Digital Library,375-381,2,"A conformance problem between Web service choreography and orchestration has attracted much interest in the research field of Web service composition. A number of formal languages have been proposed for describing both choreography and orchestration. Moreover, various notions of conformance between them have been formally defined. In most of the earlier works, however, it is assumed that the internal structures of implemented orchestration are explicit. It may not always be the case, such as the Web services implemented in. NET or Java. In this paper, we have investigated an alternative approach for verifying a conformance between choreography and the implementation whose only external behavior can be observed. We use an adapted version of Angluin's algorithm to infer a Mealy machine from the implemented Web service. By transforming the Mealy machine to the modeling formalism LTS, the model checker LTSA can be used for checking the conformance criterion in our framework.",,,,,,Analytical models;Business;Machine learning;Inference algorithms;Algorithm design and analysis;Service oriented architecture;Web service composition;Choreography;Conformance verification;Learning algorithm;Model checking,,,,,Rejected,Studies that do not address Architectural Conformance Checking as a central topic.
Conformance Checking and QoS Optimizing of Web Service Composition,"Zhang, Guojun",,2013,IEEE Digital Library,784-787,,"Due to the inherent autonomy and heterogeneity of component Web services it is difficult to predict the behavior of the overall composite service. Besides, the performance of the composed application is determined by the performance of the involved component web services. Therefore, the behavior conformance and non-functional quality of service (QoS) properties are crucial for selecting the web services to take part in the composition. The behavior conformance of component services is the guarantee of the correctness of Web service composition, and QoS properties can identify the best candidate web services from a set of functionally-equivalent services. In this paper, two formal judgmental rules are presented, which check conformance of local behavior of every component service to global interaction. We also use skyline computation to select services for composition effectively and efficiently, reducing the number of candidate services to be considered. We also define aggregation functions, and use a Multiple Attribute Decision Making approach for the utility function to achieve Qos-based optimal service selection. We evaluate our approach experimentally using both real and synthetically generated datasets.",,10.1109/CIS.2013.171,,,,Quality of service;Business;Semantics;Educational institutions;Service-oriented architecture;Grammar,,,,,Rejected,Studies that do not address Architectural Conformance Checking as a central topic.
Exercising control over the design of evolving software systems using an inverse application of reflexion modeling,"Gear, Andrew Le and Buckley, Jim",,2006,ACM Digital Library,37–es,,"A software designer often has little control over, or a means of checking, whether his design is being adhered to once implementation begins. This 'architectural drift,' where the original design and the design of the implemented system diverge can cause serious problems for evolution, maintenance and the comprehensibility of a system if it remains undocumented. The earlier such discrepancies can be identified the better. This paper proposes a process for design control based on an inverted use of a design recovery technique called Reflexion Modeling that allows the software designer to enforce his design decisions during the implementation phase of the software engineering process.A large industrial case study of the development of an IBM system called DAP is used to demonstrate the effectiveness of the process. Based on a comparison between the old implementation of DAP and the new version, our findings suggests that better design control is achievable using our inverse Reflexion Modeling approach. This is because, during the case study our process revealed violations in the design of DAP. These were captured early and marked for correction. The violations were present in spite of the fact that the architect and implementer of the system was the same person. This indicates that design violations are very easily introduced and often unintentional, particularly in larger team-development contexts.Another measure of the value of the approach is the uptake of the tool by others in the organization. This has been quite rapid, with up to 15 installations since this work began. The next step will be to monitor several more iterations of the design control process and report upon the results of this new data.",,10.1145/1188966.1189016,https://doi.org/10.1145/1188966.1189016,,,,IBM Corp.,,,,Rejected,Short papers lacking sufficient methodological detail to assess the proposed approach.
"Focus: A Light-Weight, Incremental Approach to Software Architecture Recovery and Evolution","Ding, Lei and Medvidovic, Nenad",,2001,ACM Digital Library,191,,"During the past decade, object-orientation (OO) has become the dominant software development methodology, accompanied by a number of modeling notations, programming languages, and development environments. OO applications of today are increasingly complex and user-driven. They are also developed more rapidly and evolved more frequently than was the case with software systems of the past. All of these factors contribute to a plethora of potential problems when maintaining and evolving an OO application. These problems are caused by architectural erosion, where the initial architecture of an application is (arbitrarily) modified to the point where its key properties no longer hold. We propose an approach, called Focus, whose goal is to enable effective evolution of such an application with minimal effort, by recovering its architecture and using it as the basis of evolution. Focus allows engineers to direct their primary attention to the part of the system that is directly impacted by the desired change; subsequent changes will incrementally uncover additional parts of the system's architecture. We have applied Focus to four off-the-shelf applications to date. We discuss its key strengths and point out several open issues that will frame our future work.",,10.1109/WICSA.2001.948429,https://doi.org/10.1109/WICSA.2001.948429,,,"GUI, OO, Software architecture, evolution, recovery",IEEE Computer Society,,,,Rejected,Studies that do not address Architectural Conformance Checking as a central topic.
Predicting Emergent Properties of Component Based Systems,"Bhattacharya, Sutirtha and Perry, Dewayne E.",,2007,ACM Digital Library,41–50,,"Software Product Lines (SPL), Component Based Software Engineering (CBSE) and Commercial Off the Shelf (COTS) components provide a rich supporting base for creating software architectures. Further, they promise significant improvements in the quality of software configurations that can be composed from prebuilt components. Software architectural styles provide a way for achieving a desired coherence for such component-based architectures. This is because the different architectural styles enforce different quality attributes for a system. If the architectural style of an emergent system could be predicted in advance, the System Architect could make necessary changes to ensure that the quality attributes dictated by the system requirements were satisfied before the actual system was deployed. In this paper we propose a model for predicting architectural styles, and hence the quality attributes, based on use cases that need to be satisfied by a system configuration. Our technique can be used to determine stylistic conformance and hence indicate the presence or absence of architectural drift.",,10.1109/ICCBSS.2007.25,https://doi.org/10.1109/ICCBSS.2007.25,,,,IEEE Computer Society,,,,Rejected,Studies that do not address Architectural Conformance Checking as a central topic.
